{
  "protocol_version": "0.3",
  "world_id": "TRUEFORGE_EXA_TAVILY",
  "source": {
    "repository": "truefoundry/trueforge",
    "exact_pre_demand_commit": "dd421b79216c9b42eefd7b0191e546919f8be3f1",
    "commit_time": "2026-09-23T04:49:44Z",
    "source_before_initial_demand": true
  },
  "demands": {
    "initial": {
      "issue": 852,
      "created_at": "2026-09-23T05:07:06Z",
      "natural": true,
      "provider": "exa",
      "required_capabilities": ["search"],
      "auth_regime": "required_api_key"
    },
    "followup": {
      "issue": 853,
      "created_at": "2026-09-23T05:12:43Z",
      "natural": true,
      "provider": "tavily",
      "required_capabilities": ["search"],
      "auth_regime": "optional_keyless_or_bearer"
    },
    "pair_frozen_before_treatment": true
  },
  "moderators": {
    "existing_provider_family_cardinality": 1,
    "membership_surface_fanout": 9,
    "membership_authority_sites": [
      "WebSearchProviders enum",
      "WebSearchProviderManifest discriminated union",
      "catalog schema provider variant",
      "shipped web-search catalog YAML",
      "runtime provider resolver",
      "settings secret redaction/write logic",
      "TrueFoundry env parser",
      "TrueFoundry managed-provider store synthesis",
      "UI server-adapter manifest mapper"
    ],
    "existing_runtime_interface": true,
    "existing_interface_capabilities": ["search", "fetch"],
    "boundary_state": "STRONG_RUNTIME_INTERFACE__DUPLICATED_MEMBERSHIP_AUTHORITY",
    "initial_demand_capabilities": ["search"],
    "followup_demand_capabilities": ["search"],
    "capability_bundle_mismatch": true,
    "auth_heterogeneity": "HIGH",
    "payload_heterogeneity": "UNRESOLVED_PRETREATMENT",
    "preexisting_generated_sdk_surfaces": true
  },
  "admission_gates": {
    "exact_source_locked": true,
    "independent_real_initial_demand": true,
    "independent_real_followup_demand": true,
    "pair_frozen_before_treatment": true,
    "discriminates_prior_world": true,
    "outcome_surface_frozen": true,
    "observability_firewall_frozen": true
  },
  "outcome_surface": {
    "vector": ["S0","L0","C0","A0","Q0","S1","L1","C1","A1","Q1"],
    "definitions": {
      "S": "semantic provider-membership authority sites changed in the phase",
      "L": "normalized handwritten product-source churn; generated SDK/OpenAPI artifacts excluded",
      "C": "demand-extraneous capability-conformance obligations introduced solely because an abstraction contract requires capability not required by the frozen demand",
      "A": "authentication-policy authority sites changed in the phase",
      "Q": "frozen demanded behavior validity gate"
    },
    "scalarization": false,
    "winner": "FORBIDDEN"
  },
  "observability_firewall": {
    "before_final_reveal_forbidden": [
      "git diff --stat",
      "git --shortstat",
      "git --numstat output to logs",
      "ordinary git commit summary",
      "arm-specific changed-file counts",
      "arm-specific churn or line counts",
      "arm-specific build duration comparisons"
    ],
    "arm_jobs_may_emit": [
      "SOURCE_OK",
      "MATERIALIZE_OK",
      "BUILD_OK",
      "ORACLE_OK",
      "CUSTODY_OK"
    ],
    "comparative_values_revealed_only_in_final_court": true
  }
}
